{"claims":[{"confidence":"high","id":"ctr-formula","source_ids":["google-ctr"],"statement":"CTR 等於 clicks 除以 impressions。"},{"confidence":"high","id":"cpc-formula","source_ids":["google-columns"],"statement":"平均 CPC 等於 cost 除以 clicks。"},{"confidence":"high","id":"cvr-formula","source_ids":["google-conversion-rate"],"statement":"轉換率等於 conversions 除以 eligible interactions；本課虛構資料明確把 clicks 設為 eligible interactions。"},{"confidence":"high","id":"cpa-formula","source_ids":["google-cpa"],"statement":"平均 CPA 等於 cost 除以 conversions。"},{"confidence":"high","id":"value-cost-formula","source_ids":["google-value-cost"],"statement":"本課所稱 ROAS 使用 conversion value 除以 cost。"}],"conflicts":[],"design_implications":[{"decision":"每個公式同時教分子、分母、意義與零分母修復。","evidence_refs":["ctr-formula","cpc-formula","cvr-formula","cpa-formula","value-cost-formula","csv-calculation-check"],"id":"teach-formulas-with-denominators","rationale":"正確代入與知道何時不能計算，才足以獨立完成摘要。"}],"hands_on_record":{"environment":{"runtime":"Python 3.12 csv and decimal"},"executed":true,"failure_notes":[],"id":"csv-calculation-check","input":"course/assets/campaign-data.csv","limitations":["使用自行製作的虛構彙總資料，不代表任何真實活動。"],"result":{"metrics":5,"rows":3,"status":"SUCCEEDED"}},"maintenance":{"owner":"course-researcher","review_due":"2027-01-18"},"representative_task":{"deliverable":"campaign-performance-brief.md","description":"從 CSV 計算三個活動的五項指標，依門檻判讀並提出不誇大因果的建議。","success_criteria":["三個活動的五項指標可重算","達標判斷符合 CPA 與 ROAS 雙重門檻","建議包含資料界線與下一步測試"]},"research_questions":[{"decision_use":"固定課程公式、分母與學員檢查方式。","id":"metric-definitions","question":"CTR、平均 CPC、轉換率、CPA 與轉換價值除以成本的官方定義是什麼？"}],"schema_version":1,"sources":[{"context":"定義 CTR 為 clicks 除以 impressions。","id":"google-ctr","retrieved_at":"2026-10-18","source_type":"official documentation","title":"Click-through rate (CTR): Definition","url":"https://support.google.com/google-ads/answer/2615875?hl=en-GB","version":"current help page as retrieved"},{"context":"定義平均 CPC 為廣告花費除以總點擊。","id":"google-columns","retrieved_at":"2026-10-18","source_type":"official documentation","title":"About columns in your statistics table","url":"https://support.google.com/google-ads/answer/2454071?hl=en","version":"current help page as retrieved"},{"context":"定義轉換率為 conversions 除以同期間可追蹤的 eligible interactions。","id":"google-conversion-rate","retrieved_at":"2026-10-18","source_type":"official documentation","title":"Conversion rate: Definition","url":"https://support.google.com/google-ads/answer/2684489?hl=en","version":"current help page as retrieved"},{"context":"定義平均 CPA 為總轉換成本除以轉換數。","id":"google-cpa","retrieved_at":"2026-10-18","source_type":"official documentation","title":"Average CPA: Definition","url":"https://support.google.com/google-ads/answer/6396841?hl=en","version":"current help page as retrieved"},{"context":"定義 conversion value per cost 為 conversion value 除以 cost。","id":"google-value-cost","retrieved_at":"2026-10-18","source_type":"official documentation","title":"Conversion value per cost: Definition","url":"https://support.google.com/google-ads/answer/13405059?hl=en","version":"current help page as retrieved"}],"unknowns":[{"blocking":false,"id":"platform-attribution","impact":"跨平台直接比較可能失真，因此課程只對明確固定口徑的虛構資料計算。","question":"不同廣告平台與帳戶設定是否採用相同互動、歸因與轉換口徑？"}]}
